{
  "schema_version": "1.0.0",
  "event_id": "evt_000000000004",
  "policy_id": "pol_000000000001",
  "event_type": "payment.received",
  "occurred_at": "2025-02-14T16:45:00Z",
  "effective_at": "2025-02-14T16:45:00Z",
  "ingested_at": "2025-02-14T16:45:20Z",
  "payload": {
    "payment_id": "pay_000000000001",
    "billing_id": "bil_000000000001",
    "amount_cents": 12500,
    "currency": "USD",
    "method": "electronic_transfer"
  }
}
